id,text
5,"In 1905 Albert Einstein proposed his theory of special of relativity, in which he described that the laws of physics are the same for all non-accelerating observers and that the speed of light in a vacuum (space without matter or air) was independent of the motion of all observers. In 1915, trying to include acceleration into his theory, he published the theory of general relativity which proposed the idea that massive objects cause a distortion in space-time, which is felt as gravity. In order to understand this distortion we can think of the universe as a flat piece of paper. If one were to place a very light object on the paper, nothing would happen. If you then placed a tennis ball on the paper, a space of the paper would bend around the ball and any object placed in this bent part of the paper would gravitate towards the ball. In other words, the heavier the object, the bigger the area around it that gets curved, or ‘distorted’. Similarly, heavy objects (like planets, large stars and black holes) bend the space around them; for example, the Earth bends the space around it and because the moon is within this bent (or distorted) space, it is affected by the Earths gravity. Einstein’s theory was thought to be a massive breakthrough in physics and helped us understand the universe a little better, however its been found to breakdown when dealing with the mechanics of subatomic particles (particles that are smaller than atoms, for example protons)  which is a field known as quantum mechanics. Scientists have spent many years searching for a theory which reconciles Einstein’s theory with quantum mechanics; a theory of everything.
One the most famous, albeit controversial, ideas put forward is String Theory; which describes everything in the universe to be made up of tiny, 1-dimensional, vibrating string-like particles. It is thought that the way these string-like particles vibrate and interact with one another determines the structure and properties of the object it makes up and, in turn, the structure and properties of the universe. Within string theory is another interesting theory known as the Multiverse Theory which puts forward the idea that our universe is not the only one which exists, that there are in fact others which exist parallel to ours; parallel universes. 
Some scientists think that these universes are very similar to ours and that there could be copies of us that exist in these universes, some of whom may be similar to us and some who may be very different to us. For example, in one of these universes there could be a copy of me who is actually good at writing, but that’s just unrealistic. Other scientists think that these universes could be so different from ours that they follow fundamentally different laws of physics. Of course, no one has ever proven that these so-called parallel universes exist nor has there ever been any signs of their existence, or maybe just none that we have been able to observe yet. A few weeks ago I read an article which described how there are some scientists who believed that there is dark matter leaking into some galaxy from a parallel universe, currently, however, there is no way to prove this. 
In Islam we are taught that there are beings known as jinn; entities created from a smokeless-fire, who roamed the earth before Adam. These beings are said to exist in a universe that is parallel to ours, in which they can see and in some cases interact with us whereas we cannot see or interact with them. There is also a Quranic verse which translates to All praise belongs to God, Lord of the worlds. Fakhruddin Razi, an Iranian Sunni muslim theologian and philosopher raised the question whether the term “worlds” in this context meant “multiple worlds within this single universe” or to “many other universes (a multiverse) which exists beyond our known universe”. He concluded that even if a multiverse didn’t exist, it is definitely possible as the power of God knows no limits and He could create an infinite number of universes.
Is a bad person just a bad person? J K Rowling once wrote The world isn’t split into death eaters and good people. We have all got both light and darkness inside of us. What matters is the power we choose to act on, that’s who we really are. If we accept this logic, then surely we must accept that even some of the most ‘evil’ people have some good in them, which exists parallel to the bad. There is a man who stays in Newclare that is suspected to be a drug dealer, someone we might consider to be a bad person. But at the same time, he provides the people in the community with food, which is something that even the ‘good’ people, in the same community, fail to do.  
So maybe parallel universes do exist, just not in the way that we currently think of them. Maybe each person is like a universe and all the different parts of their personality are the parallel universes that make up who they are. There is an old Japanese proverb that says we have three faces; one we show to the world, one we show to close friends and family and one we only show to ourselves, which is the truest reflection of who we are. This may seem like an obvious fact, because it’s clear that most, if not all, of us have many different levels to who we are. And no, I don’t mean in the way that some girls think reading Paulo Coelho books gives them more substance. 
How many times have we met someone and a few weeks, months or even years afterwards we think that they have changed so much from the person we first met. Sometimes we may even think that we have changed. But maybe it’s not as simple as that. Maybe when we met we just failed to see the countless other universes that existed beyond the one that was shown to us and, over time, we began to become aware of their existence. That is surely how it feels with her.
When we first met, the part of me that she began to know, and fall in love with, was very different than the part of me she met when we had our last conversation. I often regret how her perception of me must have changed from this sweet, lovable person to someone so full of anger. The truth is, the anger was always there, even if she didn’t meet it till some time after we first met. Or maybe I just want to think that, because it would mean that the sweet, lovable person she met all those years ago still exists. In a black-and-white version of this story I am a villain but, of course, the world exists in color. Although I am a pretty closed up person, I have a habit of spilling things I don’t, can’t, tell anyone into the words of my stories but, in this case, I will avoid going into too much detail. I like to believe that, in her eyes, the hero inside me still exists, in parallel to the other side of me that broke her heart. I may never find this out, I may never want to. I don’t know whether I believe in the multiverse or not but I can say this; I like to think that there exists a version of us that was never jealous or insecure, a version of us that loves each other for who we are and not who we want each other to be. Most of all, I like to think that there is a version of us who overcame all the obstacles life threw at us and still wound up together; but then again, I ask myself, what if we are that version of us?
I think it’s important that we become aware that everyone we meet, and even those we think we know, are more than what they seem to be. And more than that, we should accept each other for all that we are. Maybe the reason that we like eye contact so much is that when our eyes meet another’s, we get a glimpse into the universes that reside within, waiting to be explored by someone who cares, someone who can understand. We sometimes find it easy to judge a person by something they’ve done. But I think that what really defines a person is much, much more than that. We are not defined by where we come from or the things we may have done, but rather by the potential that lies within and what we choose to do with that, who we choose to be. I think it’s only with that realization that we can really break through the boxes society has placed us in, and become much more than they ever intended. Because life is a story, and we are all the authors of our own destinies. Because you may just be a kid from the streets of Newclare but that doesn’t mean you have to fall into the vicious cycle of drugs and gangs that is all around you, you can aspire to something greater; the only limits are the ones that exist in your mind. The late Stephen Hawking once said There should be no boundaries to human endeavor. No matter how bad things may seem, there is always something you can do, and succeed at; while there is life, there is hope. 
"
6,"Since the beginning of “intelligent” civilization, mankind has always wondered about where we come from, and where we’re going. Over the centuries, many theories have been formulated. In 1929 an astronomer named Edwin Hubble made some important observations that distant galaxies seemed to be moving away not only from each other, but from us as well, meaning that the universe is expanding.  This important discovery leads us to one logical conclusion; if the universe is expanding, then surely if we were to wind back the clocks and go back in time all those billions of years ago, we would find that the universe once existed as a single point, and this leads us to the big bang theory. 
13.8 billion years ago, the universe was very different to what we know it to be today, it was just a high density, high pressure point until a spectacular explosion occurred, which resulted in the universe being born. Although we haven’t yet been able to prove that the big bang actually happened, we do have some clues such like the fact that the universe is expanding, and it is still the most universally accepted model of the universe. The idea of the universe having a finite past is credited to many of the great thinkers of the past, including Persian born Muslim philosopher Abu Hamid Al-Ghazali.
A particle accelerator is an apparatus for accelerating subatomic particles (particles that are smaller than atoms) to high velocities by means of electric or electromagnetic fields. The accelerated particles are generally made to collide with other particles, either as a research technique or for the generation of high-energy X-rays and gamma rays. 100 hundred meters below the border of Switzerland and France there is a particle accelerator known as the Large Hadron Collider (or CERN supercollider) which scientists are currently running experiments on to try and prove the big bang theory, as well as better understand what exactly happened at the time the universe was created. 
By smashing protons together with enough force and speed, the CERN supercollider will cause protons to break apart into smaller atomic subparticles. These tiny subparticles are very unstable and only exist for a fraction of a second before decaying or recombining with other subparticles. According to the big bang theory, all matter in the early universe consisted of these tiny subparticles. As the universe expanded and cooled, these particles combined to form larger particles like protons and neutrons; in essence, they formed the universe. 
The funny thing is, these protons existed before the experiment; they had, in a way, their own individual stories, until they were made to collide, then their stories would forever be intertwined and told as one. Much like ours.
You see, I still believe that we were destined to meet; that life served as a particle accelerator, constantly taking us closer towards one another. Until it finally happened, we met, and our two separate tales became one. And the spectacular explosion that was our love caused ripples throughout space and time and created a new universe, one in which our story will never be forgotten. Although I only met you in the latter parts of my life, it does get hard to remember a time when you weren’t in my life, in some capacity. And even if now we’re just strangers with all these memories, you still exist in my mind, as an important part of me that will always be remembered.
For the first time in years I started a new year without you and I tried to hide it, but it was really hard for me to pretend like I was okay. I read the letter you wrote for me to read on our first new year’s eve together and I don’t have too much pride to admit I cried. I thought of the first time I read it; I was at a beach party in Singapore and I had to step out of the crowd because I literally fell to my knees because I couldn’t breathe. And then the clock struck 12 and everyone around me was celebrating but I was standing there like a weirdo, reading your letter. I remember feeling so content and happy at that moment.
I continued crying as I went on to read all the letters you’d ever written me, yes I still have all of them, even the not-so-serious ones. The beautiful thing is that they weren’t sad tears, I mean yes it hurt, but I was smiling as the tears rolled down my cheeks because it reminded me of how special you are, and just how real we were.
I wish I had met you earlier in life, so that we could have had some more time together before I fucked everything up. And I know you’re not coming back and I know exactly why, but I can’t help myself from still hoping you’ll be my forever, even if I know that’s not going to happen. I have been trying to make peace with the fact that you’re gone and most days I am able to pretend that I’m okay. At the very least, I know you’ll never be truly gone, because the ones we love never truly leave us, they’re always with us, in our hearts."
7,"In physics, the theory of everything is a hypothetical framework that would explain everything in the universe, from gigantic objects like black holes to tiny particles like protons. Currently, there are two different theories: Relativity and quantum theory. Albert Einsteins theory of general relativity attempts to explain the behavior of very large objects in the universe like planets, stars and black holes. Quantum theory attempts to explain the behavior of very tiny objects in the universe like protons. One of the biggest problems in physics is that general relativity and quantum theory don’t seem to play very well together; Einsteins theory doesn’t hold for subatomic particles. For years, scientists have been trying to find a framework that would reconcile relativity with quantum theory and to date none has been found. Some scientists argue that the name theory of everything is deceiving because even if such a framework is proven to exist it wouldn’t answer all our questions about the universe, but would rather open the door for us to know what questions we should be asking. This idea is also present in philosophy. A philosophical theory of everything would answer questions like ‘Why is reality understandable?’ or ‘Why is there anything at all?’
I think an often overlooked area in which a theory of everything exists is relationships. I often try to reconcile why certain relationships work and why others fail. Of course, this is a difficult question to answer; whether you’re asking it about your own relationships or other peoples’.  Most people have probably had at least one relationship they thought, hoped, would last forever. Looking back at the black box of those failed relationships there may be reasons as to why things didn’t work out but I think we often find ourselves wondering why those reasons were enough to come between all the love we had for that person. I think if we want to answer this question, there are two big ideas we must consider.
The first is the idea of destiny. In Islam, the belief that God has designed a plan for all of us (predestination) is one of the six articles of Iman (faith). This means that everything in our lives from the day we are born to the day we die has been written before we were even conceived. It follows, then, that the Quran also has a verse which translates to “We created you in pairs”. This ties in to the common belief that everyone has someone in this world that they’re meant to end up with; a soulmate. The definition of a soulmate is “a person ideally suited to another as a close friend or romantic partner”. I’ve always been the type to believe in soulmates, to believe that somewhere out there is someone who is a perfect fit for me but after having been in love (thinking, hoping, she was my soulmate) I find myself questioning the whole concept altogether. Not in some sad way that I think I’ll die alone, but rather just taking a more logical approach. On the surface, the idea of soulmates is very intriguing, but once we start to question it we realise that it’s actually not built on a very solid foundation and it all comes crumbling down, like a house of cards. The most obvious question is; what if my soulmate dies before I’ve met them? Does that mean then whoever I end up with is just a consolation prize? I sure hope not. I like to believe that one person could have multiple soulmates and ending up with any one of them would be more than enough to make you happy. 
I think the biggest problem many relationships face is that most people are more interested in ending up with the person who sets their hearts on fire, figuratively of course. I once read a post that posed the question “is love a choice or a feeling?” and when I was younger and more naïve I confidently answered “it’s a feeling, of course”. The post went on to state that, more often than not, marriages lasted longer when the couples believed love was a choice and marriages ended when the couples believed it was a feeling. The post made the argument that love was a very unstable foundation on which to build a relationship. Because there may be days where you love your partner less and would then have to make the choice to stay with them, to keep loving them. As hard as it is to admit, just believing that someone is your soulmate and that they were made for you is not enough to build a successful relationship. At most, it is only one half of the equation. Which brings us to the second idea. 
The second is the idea of compatibility. Compatibility is defined as “a state in which two things are able to exist or occur together without problems or conflict”. I think one of the reasons a lot of people find their relationships failing is that they’re always looking for the person who’ll make their hearts skip a beat and not the person who they’re most compatible with. Of course, humans are all unique and the chances that you’ll meet someone with whom you have no problems or conflict is very, very small. The difference comes in when you choose a partner that you’re compatible with. Someone whose life and personality fits together with yours. For example, if you’re someone who prefers spending intimate time with people closest to you, you probably wouldn’t be compatible with someone who prefers to be at parties whenever there is one. This, however, introduces the notion of compromise. The party-goer may help the introvert come out of their shell and the introvert may help the party-goer realise the beauty in spending a Saturday night doing nothing with someone who means everything. 
Because humans are unique and complicated it can be a bit difficult to spot someone who you’re compatible with. But I believe that when you find them, you will have one of the healthiest and happiest relationships you’ve ever been in. In a time where almost everything is available to us almost immediately, we’ve lost patience. When we want something, we want it now; when we want someone to make us happy, we want them now. But if we want to find someone we’re compatible with, we have to learn to be patient, and enjoy the process of getting to know someone. Knowing who they are and, furthermore, knowing what makes them who they are. Knowing what makes them happy, sad, or angry. Knowing how their smile forms, or how their tears fall. Knowing the things they hate as well as the things that set their hearts on fire. And knowing someone takes time. Sometimes we may meet someone and immediately feel a connection to them and mistake this for compatibility. Only to found out, a few months and two broken hearts down the line, that you were never compatible.
As with soulmates, there are definitely multiple people you will meet that you are compatible with. So the question is then, how does one decide on who they should be with? I think that the answer is that we should look for the few people that are at the intersection of ‘someone who makes my heart skip a beat’ and ‘this is someone I’m actually compatible with’. As with physics, this theory of everything will not provide a complete answer to everything we want to know about successful relationships, but will rather provide us with a much stronger foundation on which to build relationships that are more likely to end up successful. As a person who has been in a relationship, that didn’t work out, with someone who fell into this intersection, I can personally say that even this strong foundation is not enough; it just give you a better chance.
It may take time and you may get impatient but it’s important to always remember that this is just part of the process. And that there is someone out there for you to fall hopelessly in love with. The best you can do in the interim is just work on yourself and your own goals and wait until you find them, or they find you. Islam teaches us a valuable lesson about destiny, what’s meant for you will never miss you even if it’s beneath two mountains and what’s not meant for you will never reach you even if it’s between your lips. 
"
